{
  "version": "1.0",
  "slug": "hello",
  "title": "Hello",
  "blocks": [
    {
      "id": "257b5a30-bfc1-4a1c-9b54-66d2f9d3d3f1",
      "type": "blob",
      "props": {
        "title": "Nouveau bloc",
        "emphasisText": "",
        "eyebrow": "",
        "eyebrowTheme": "brand",
        "subtitle": "Sous-titre du bloc",
        "markerType": "text",
        "markerContent": "01.",
        "markerIcon": "",
        "markerPosition": "left",
        "markerStyle": "default",
        "markerSize": "auto",
        "markerTheme": "brand",
        "markerRounded": "rounded-square",
        "figureType": "image",
        "figureWidth": "",
        "figureBleed": "full",
        "image": "/desert.jpg",
        "video": "",
        "actions": "before",
        "buttons": "[{\"label\":\"Hello\",\"externalHref\":\"#\",\"variant\":\"default\",\"theme\":\"white\",\"opensInNewTab\":\"false\",\"linkType\":\"internal\",\"customAction\":\"action2\"},{\"label\":\"More\",\"linkType\":\"internal\",\"internalHref\":\"\",\"externalHref\":\"\",\"customAction\":\"action1\",\"variant\":\"ghost\",\"theme\":\"red\",\"opensInNewTab\":\"false\"}]",
        "showContent": "true",
        "contentType": "text",
        "contentText": "coucoucou",
        "fontSize": "md",
        "size": "lg",
        "layout": "bar",
        "direction": "",
        "align": "left",
        "paddingX": "auto",
        "paddingY": "auto",
        "gutter": "auto",
        "appearance": "outlined",
        "theme": "brand",
        "backgroundType": "none",
        "backgroundColor": "default",
        "backgroundImage": "",
        "backgroundStyle": "style1",
        "showSeparator": "false",
        "separatorType": "line",
        "separatorPosition": "afterTitle",
        "separatorColor": "blue",
        "titleAs": "div",
        "eyebrowAs": "div"
      },
      "children": []
    },
    {
      "id": "aa81c544-fedf-46d3-8b59-a364f3014c1f",
      "type": "section",
      "props": {
        "blockAlignment": "wide"
      },
      "children": []
    },
    {
      "id": "031306c5-7ad7-43ab-8388-b0bc37d730bb",
      "type": "section",
      "props": {
        "blockAlignment": "full"
      },
      "children": []
    },
    {
      "id": "de33c558-4adf-44b3-95a9-2422cdb7185c",
      "type": "paragraph",
      "props": {
        "backgroundColor": "default",
        "textColor": "default",
        "textAlignment": "left"
      },
      "content": [],
      "children": []
    }
  ],
  "meta": {
    "createdAt": "2026-03-05T07:55:12.528Z",
    "updatedAt": "2026-03-06T10:47:22.768Z"
  }
}